{
  "contract_id": "CONFENGE_CORPORATE_TAXONOMY",
  "contract_version": "1.0.0",
  "schema_id": "confenge-corporate-taxonomy/v1",
  "as_of": "2026-10-14",
  "decision_date": "2026-09-04",
  "owner_issue": 578,
  "parent_issue": 577,
  "producer": {
    "authority": "web-cfg-mv-01",
    "repository": "tjsasakifln/web-cfg",
    "path": "data/corporate/taxonomy.v1.json"
  },
  "corporate_category": {
    "id": "engineering_expert_evidence_technical_intelligence",
    "public_name": "Engenharia, Perícias e Inteligência Técnica",
    "public_name_en": "Engineering, Expert Evidence and Technical Intelligence",
    "exclusive_to_nucleus": null,
    "b2g_is_corporate_category": false
  },
  "public_identity": {
    "brand": "CONFENGE",
    "domain": "confenge.com.br",
    "canonical_surface": "https://confenge.com.br/",
    "allowed_brands": [
      "CONFENGE"
    ],
    "allowed_domains": [
      "confenge.com.br"
    ],
    "sub_brand_policy": "forbidden"
  },
  "owner_planes": {
    "web-cfg": [
      "public_surface",
      "inbound_acquisition",
      "trust",
      "offer_publication",
      "capture",
      "public_analytics"
    ],
    "extra-cli": [
      "canonical_facts",
      "provenance",
      "identity",
      "select_only_contracts"
    ],
    "governance": [
      "policy",
      "approval",
      "exception",
      "kill_switch"
    ],
    "warmbly": [
      "commercial_action",
      "cadence",
      "opportunity_state",
      "dispatch",
      "outcomes"
    ],
    "meetcfg": [
      "accepted_context_consumer"
    ]
  },
  "north_star": {
    "metric": "qualified_commercial_opportunity",
    "segment_by": "nucleus_id",
    "downstream": [
      "proposal",
      "revenue"
    ],
    "not_success_metrics": [
      "page_count",
      "raw_leads",
      "impressions",
      "commits",
      "closed_issues"
    ]
  },
  "addition_rules": {
    "nucleus": "Founder decision plus ADR amendment plus taxonomy version bump. The new nucleus needs a unique ASCII id and every required field. A nucleus is not a sub-brand, domain or second identity model.",
    "offer": "The finite offer catalog owns commercial records. An offer references an existing nucleus_id; a missing nucleus fails closed. This taxonomy stores offer_id only and never duplicates price, SLA or checkout.",
    "route": "Every indexable public route stays in public-family-registry with visitor job, terminal action and conversion-gate coverage. MV-09 applies shared-registry integration; this producer does not edit that file.",
    "location": "Geography is a qualification field, not a nucleus or doorway-page multiplier. National availability never overrides local professional formalities.",
    "proof": "Proof items need source, date and permission class. Invented credentials, rankings, cases or seals fail closed. extra-cli owns facts when acquisition is required."
  },
  "expression_policy": {
    "nuclei_role": "internal_operational_grouping",
    "nucleus_names_required_in_public_copy": false,
    "public_entrypoint_contract": "CONFENGE_PUBLIC_INTENT_MATRIX/1.0.0",
    "public_entrypoint_path": "data/corporate/intent-family-matrix.v1.json",
    "route_source_of_truth": "intent_family_not_persona",
    "unknown_demand_state": "NEEDS_CONTEXT"
  },
  "nuclei": [
    {
      "id": "expert_evidence_assistance",
      "public_name": "Perícias e Assistência Técnica",
      "corporate_category_id": "engineering_expert_evidence_technical_intelligence",
      "visitor_job": "Decidir se a CONFENGE pode produzir prova técnica ou assistência em disputa cível, condominial, imobiliária ou trabalhista, e qual o próximo passo documentado.",
      "icps": [
        "advogados que precisam de suporte técnico",
        "empresas em litígio ou notificação",
        "síndicos e administradoras de condomínio",
        "partes em processo judicial ou extrajudicial"
      ],
      "triggers": [
        "laudo, vistoria ou parecer técnico solicitado",
        "assistência técnica a advogado ou parte",
        "patologia, vício ou dano em edificação",
        "disputa trabalhista com componente de SST"
      ],
      "typical_decisions_artifacts": [
        "parecer técnico",
        "laudo pericial de parte",
        "quesitos e respostas técnicas",
        "cronologia documental da prova"
      ],
      "limits": [
        "não é advocacia nem representação jurídica",
        "não é nomeação como perito do juízo",
        "não promete êxito processual",
        "ART somente quando o ato e a atribuição a comportarem"
      ],
      "conflict_profile": "Alto. Atuação como assistente técnico de uma parte; não atuar simultaneamente para partes opostas no mesmo conflito.",
      "sensitivity_profile": "Alta. Peças processuais, dados de partes e documentos de obra permanecem fora de analytics e de páginas públicas.",
      "geo_field_rule": "Atendimento em todo o Brasil. Escopo, local, campo, logística, atribuições, registro ou visto e ART são confirmados antes de assumir responsabilidade técnica; não gerar páginas doorway por cidade.",
      "proof_classes": [
        "credential",
        "method",
        "permissioned_case",
        "UNKNOWN"
      ],
      "terminal_action": "capture_form",
      "owner_plane": "web-cfg",
      "referenced_offers": [
        {
          "offer_id": "expert_evidence_technical_assistance",
          "status": "candidate",
          "catalog_contract": "CONFENGE_OFFER_CATALOG/2.0.0"
        }
      ],
      "metrics": {
        "north_star": "qualified_commercial_opportunity",
        "segment": "expert_evidence_assistance",
        "downstream": [
          "proposal",
          "revenue"
        ]
      },
      "publication_status": "draft",
      "deprecated": false
    },
    {
      "id": "property_valuation",
      "public_name": "Avaliações de Imóveis",
      "corporate_category_id": "engineering_expert_evidence_technical_intelligence",
      "visitor_job": "Obter um laudo ou parecer de avaliação para disputa, garantia, negociação, incorporação, patrimônio ou decisão de investimento.",
      "icps": [
        "advogados e partes em disputa imobiliária",
        "empresas com garantia ou patrimônio a mensurar",
        "incorporadoras e gestores de ativo",
        "famílias e condomínios em partilha ou regularização"
      ],
      "triggers": [
        "necessidade de valor de mercado documentado",
        "garantia, dação, partilha ou desapropriação",
        "negociação ou decisão de investimento",
        "divergência sobre valor em processo"
      ],
      "typical_decisions_artifacts": [
        "laudo de avaliação",
        "parecer de valor",
        "memória de premissas e limitações"
      ],
      "limits": [
        "não é intermediação imobiliária",
        "não é garantia de venda ou financiamento",
        "premissas e UNKNOWN permanecem visíveis",
        "ART somente quando o ato e a atribuição a comportarem"
      ],
      "conflict_profile": "Médio-alto quando o valor alimenta disputa entre partes.",
      "sensitivity_profile": "Alta. Endereço, matrícula e valores de ativo não vazam para analytics.",
      "geo_field_rule": "Atendimento em todo o Brasil. Avaliação e vistoria dependem de local, logística, método, atribuições, registro ou visto e ART confirmados; sem páginas doorway por bairro ou cidade.",
      "proof_classes": [
        "credential",
        "method",
        "permissioned_case",
        "UNKNOWN"
      ],
      "terminal_action": "capture_form",
      "owner_plane": "web-cfg",
      "referenced_offers": [
        {
          "offer_id": "property_valuation_report",
          "status": "candidate",
          "catalog_contract": "CONFENGE_OFFER_CATALOG/2.0.0"
        }
      ],
      "metrics": {
        "north_star": "qualified_commercial_opportunity",
        "segment": "property_valuation",
        "downstream": [
          "proposal",
          "revenue"
        ]
      },
      "publication_status": "draft",
      "deprecated": false
    },
    {
      "id": "building_engineering_documentation",
      "public_name": "Engenharia de Edificações e Documentação",
      "corporate_category_id": "engineering_expert_evidence_technical_intelligence",
      "visitor_job": "Elaborar, revisar ou compatibilizar projetos de engenharia, orçar ou documentar uma edificação pública ou privada com entrega, utilidade e responsabilidade técnica definidas.",
      "icps": [
        "proprietários e síndicos",
        "construtoras e incorporadoras privadas",
        "projetistas que precisam de compatibilização",
        "gestores de ativo que precisam de prontidão técnica"
      ],
      "triggers": [
        "orçamentação ou conferência de quantitativos",
        "compatibilização BIM / conflito de projeto",
        "inspeção, patologia ou laudo de reforma",
        "as built e regularização documental"
      ],
      "typical_decisions_artifacts": [
        "projeto de engenharia com desenhos, especificações e memórias na fase contratada",
        "orçamento ou conferência",
        "relatório de compatibilização",
        "laudo de inspeção ou patologia",
        "as built e dossiê de regularização"
      ],
      "limits": [
        "não substitui o responsável técnico da obra do cliente",
        "não é execução de obra",
        "escopo limitado à atribuição profissional aplicável",
        "ART somente quando o ato e a atribuição a comportarem"
      ],
      "conflict_profile": "Médio. Evitar atuar em lados opostos da mesma edificação em disputa.",
      "sensitivity_profile": "Média-alta. Plantas, custos e falhas construtivas são privados até permissão.",
      "geo_field_rule": "Atendimento em todo o Brasil. Projeto, revisão, documentação e campo dependem da disciplina, do local, das atribuições, do registro ou visto e da ART aplicável; sem expansão doorway por cidade.",
      "proof_classes": [
        "credential",
        "method",
        "synthetic_labeled",
        "UNKNOWN"
      ],